{"schemaVersion":2,"contract":"paper-fill-list","requestId":"request-synthetic","asOf":"2026-10-14T08:00:00+00:00","items":[{"fillId":"fill-synthetic","walletId":"wallet-synthetic","economicEventId":"event-synthetic","instrumentId":"instrument-synthetic","instrumentSpecVersionId":"spec-synthetic","side":"buy","positionSide":"net","price":"100.25","quantity":"0.01","occurredAtUtc":"2026-10-14T08:00:00+00:00","knownAtUtc":"2026-10-14T08:00:00+00:00","publicationSequence":2,"rootFillId":"fill-synthetic","revision":1,"replacesFillId":null,"correctionReason":null,"replacedByFillId":null,"accounting":"unprojectedIncomplete"}],"nextCursor":null,"publicationWatermark":2,"snapshotCursor":"synthetic-fill-snapshot","streamRevision":2}
